date,keyword,title,description,source,url,risk_score
2026-03-08 01:45:41+00:00,semiconductor,Kepler Capital Sticks to Its Hold Rating for BE Semiconductor (0XVE),"In a report released on March 6, Ruben Devos from Kepler Capital maintained a Hold rating on BE Semiconductor, with a price target of €180.00. ...",Markets Insider,https://markets.businessinsider.com/news/stocks/kepler-capital-sticks-to-its-hold-rating-for-be-semiconductor-0xve-1035907918,0.0
2026-03-08 01:56:00+00:00,opec,"Gulf crisis: Now, Kuwait announces cuts in oil, refining output","Middle East News: Kuwait, OPEC's fifth-biggest producer, cut oil and refinery production following the near-halt of shipping traffic through the Strait of Hormuz, the l.",Times of India,https://timesofindia.indiatimes.com/world/middle-east/gulf-crisis-now-kuwait-announces-cuts-in-oil-refining-output/articleshow/129246154.cms,0.0666666666666666
2026-03-08 02:13:07+00:00,interest rate,Looking for higher FD returns? Check how much interest rates top NBFCs offer in India,"NBFCs usually provide fixed deposit rates higher than traditional banks, reaching up to 7-8%. Here's how much interest rate top financial institutions are offering in India.",Livemint,https://www.livemint.com/money/personal-finance/looking-for-higher-fd-returns-how-much-interest-rates-top-nbfcs-offer-bajaj-finance-muthoot-capital-shriram-finance-11772879827171.html,0.0
2026-03-08 02:57:52+00:00,liquidity,Best Crypto Presale February 2026: Bitcoin ETFs Recover With $311 Million Weekly Inflows as Pepeto Presale Advances Alongside the Broader Market Reset,Explore the Best Crypto Presale 2026 and discover innovative projects like PepePawn raising millions in liquidity.,TechBullion,https://techbullion.com/best-crypto-presale-february-2026-bitcoin-etfs-recover-with-311-million-weekly-inflows-as-pepeto-presale-advances-alongside-the-broader-market-reset/,0.0666666666666666
2026-03-08 03:16:30+00:00,ai regulation,‘Scientific community in PGI clearly knows ways to advance medical knowledge and improve patient care’: AIIMS Dean,"Talking of Artificial Intelligence in the field of health, the AIIMS Dean noted that AI should not be dealt with in isolation, and should complement health services, for instance, in screening, it can ease the burden of health care workers and improve objectivity and needs regulation.",The Indian Express,https://indianexpress.com/article/cities/chandigarh/scientific-community-pgi-medical-knowledge-improve-patient-care-aiims-dean-10570741/,0.0
2026-03-08 03:21:42+00:00,unemployment,Kerala urged to develop innovation hubs to boost capital inflow,The discussions also highlighted the need to address unemployment and the state’s fiscal challenges to ensure sustained economic growth.,The New Indian Express,https://www.newindianexpress.com/cities/kochi/2026/Mar/08/kerala-urged-to-develop-innovation-hubs-to-boost-capital-inflow,0.0
2026-03-08 03:58:10+00:00,blockade,"Global Oil Supply Crippled As Gulf Attacks, Hormuz Blockade Send Prices Surging",Crude oil prices surged 35% amid attacks on Gulf energy infrastructure and the near shutdown of tanker traffic through the Strait of Hormuz.,Benzinga,https://www.benzinga.com/markets/commodities/26/03/51117517/global-oil-supply-crippled-as-gulf-attacks-hormuz-blockade-send-prices-surging,0.1333333333333333
2026-03-08 04:03:00+00:00,liquidity,10 penny stocks plunge up to 53% in a month - Are you affected?,"Over the past 1-month, 10 penny stocks have recorded sharp declines, falling between 25% and 53%. These underperformers were identified through a targeted screening approach focused on stocks with a market capitalisation below Rs 1,000 crore, a share price under Rs 20, and a minimum recent trading volume of 5 lakh shares. The strategy aims to highlight low-priced, actively traded penny stocks that have experienced significant downside. (Data Source: ACE Equity)Although penny stocks often attract investors with their low entry prices and potential for rapid gains, they come with substantial risks. Due to low liquidity, high volatility, and limited transparency, they are prone to manipulation and sudden price drops. Without a clear strategy and strong risk controls, investors may face more losses than gains. Penny Stock Plunge",The Economic Times,https://economictimes.indiatimes.com/markets/stocks/news/10-penny-stocks-plunge-up-to-53-in-a-month-are-you-affected/slideshow/129250397.cms,0.0666666666666666
2026-03-08 05:00:00+00:00,unemployment,Yorkshire Dales Millennium Trust offers more apprenticeships,"Yorkshire Dales Millennium Trust expands rural apprenticeships for young people in North Yorkshire, tackling youth unemployment and boosting…",Northern Echo,https://www.thenorthernecho.co.uk/news/25913407.yorkshire-dales-millennium-trust-offers-apprenticeships/,0.0
2026-03-08 05:14:53+00:00,default,Sony faces $2.7 bn class action from UK PlayStation users,"Japanese entertainment giant Sony will face a £2 billion ($2.7 billion) class action lawsuit starting Tuesday in London, accused of allegedly breaching competition law by overcharging millions of UK PlayStation users. Under UK law, all potentially affected persons are included in this type of class action by default, and may benefit from possible compensation, unless they voluntarily opt out.",The Economic Times,https://economictimes.indiatimes.com/tech/technology/sony-faces-2-7-bn-class-action-from-uk-playstation-users/articleshow/129253025.cms,0.0666666666666666
2026-03-08 06:00:00+00:00,interest rate,Bank of England May Be Wary of Looking Past Another Energy Shock,"Later this week, Bank of England policymakers will receive their first briefings as preparations for the March 19 interest-rate decision get under way. The question is how far they are willing to tolerate an energy-price shock that is threatening to blow inflation off course.",Bloomberg,https://www.bloomberg.com/news/articles/2026-03-08/bank-of-england-may-be-wary-of-looking-past-another-energy-shock,0.0666666666666666
2026-03-08 06:13:06+00:00,blockade,Palestinians risk life and limb to fish in Gaza’s Israeli-controlled sea,"Gaza’s fishing industry collapses under Israeli blockade, leaving fishermen risking their lives for minimal catches.",Al Jazeera,https://www.aljazeera.com/features/2026/3/8/palestinians-risk-life-and-limb-to-fish-in-gazas-israeli-controlled-sea,0.0666666666666666
2026-03-08 07:20:00+00:00,gdp,Global Times: China has solid basis to achieve GDP goal: NDRC,"BEIJING, March 8, 2026 /PRNewswire/ -- China's GDP is expected to grow by over 6 trillion yuan ($869.6 billion) in 2026, equivalent to the total annual GDP volume of a developed economy, Zheng Shanjie, head of the National Development and Reform Commission (NDRC), the country's top economic planner, told a press conference on the sidelines of the fourth session of the 14th National People's Congress in Beijing on Friday.",The Manila Times,https://www.manilatimes.net/2026/03/08/tmt-newswire/pr-newswire/global-times-china-has-solid-basis-to-achieve-gdp-goal-ndrc/2295440,0.0
2026-03-08 07:39:47+00:00,opec,"Indian stock market may have a big gap-down opening on Monday, Nifty 50 may slip below 24K this week; here's why","US-Iran war: Global markets, including the Dow Jones and the Indian stock market, may come under pressure amid ongoing Middle East tensions and oil production shutdowns in several OPEC countries",Livemint,https://www.livemint.com/market/stock-market-news/usiran-war-indian-stock-market-may-have-a-big-gap-down-opening-on-monday-nifty-50-may-slip-below-24k-this-week-11772953700550.html,0.0666666666666666
2026-03-08 07:41:26+00:00,recession,Iran: The Straw That Potentially Breaks The Camel's Back,"Oil prices jumped 35% after Iran war fears, raising recession risk. Read more macro analysis here.",Seeking Alpha,https://seekingalpha.com/article/4879863-iran-straw-that-potentially-breaks-camel-back,0.1333333333333333
2026-03-08 07:44:18+00:00,interest rate,Tax savings FDs vs National Savings Certificate? Check interest rate and other details to choose what works best for you,Tax savings FDs vs National Savings Certificate? Check details and rate of interest to choose what works best for you,Livemint,https://www.livemint.com/money/personal-finance/tax-savings-fd-fixed-deposits-or-india-post-national-savings-certificate-nsc-investment-option-choose-what-works-for-you-11772951315608.html,0.0
2026-03-08 07:47:00+00:00,interest rate,Fed nominee Warsh faces hurdles on rate cuts,"Kevin Warsh is still months away from taking the helm at the Federal Reserve, but his ability to deliver the interest rate cuts President Donald Trump expects is facing hurdles as the U.S. economy, and his future colleagues, tilt in the opposite direction.",Arkansas Online,https://www.arkansasonline.com/news/2026/mar/08/fed-nominee-warsh-faces-hurdles-on-rate-cuts/,0.0666666666666666
2026-03-08 08:03:33+00:00,liquidity,NSC vs Tax-Saving FD: Which 5-Year Investment Offers Better Returns and Tax Benefits,"Both investment options qualify for tax deductions under Section 80C of the Income Tax Act, but they differ in terms of returns, taxation, liquidity, and overall suitability for investors.",Zee News,https://zeenews.india.com/personal-finance/nsc-vs-tax-saving-fd-which-5-year-investment-offers-better-returns-and-tax-benefits-3024893.html,0.0666666666666666
2026-03-08 08:35:42+00:00,fed,Peace lilies will grow flowers year after year if fed one common food scrap,"Peace lilies can be tricky when their white flowers fall off quickly, but one gardener shares how an everyday food scrap can help achieve repeat blooms year after year.",Liverpool Echo,https://www.liverpoolecho.co.uk/news/property/how-grow-more-peace-lilies-33550838,0.0
2026-03-08 08:40:00+00:00,blockade,"Buses set on fire, road blocked in Jhenaidah after youth beaten to death","Angry students and locals set three buses on fire in Jhenaidah after a youth was allegedly beaten to death by employees of a petrol pump. In protest, transport workers later blocked the road at the district’s central bus terminal on Sunday morning. The blockade began...",Dhaka Tribune,https://www.dhakatribune.com/bangladesh/nation/404965/buses-set-on-fire-road-blocked-in-jhenaidah-after,0.0666666666666666
2026-03-08 08:55:05+00:00,downgrade,I volunteered to downgrade from Premium Economy on a seven-hour flight - and here's why you should too,"While cabin upgrades are common, it's rare passengers are given the option to voluntarily downgrade on flights - but is it really worth giving up a premium seat, and, if so, what are the benefits?",Daily Mail Online,https://www.dailymail.co.uk/travel/article-15614031/why-volunteer-downgrade-class-flight.html,0.0666666666666666
2026-03-08 09:00:00+00:00,data center,Tech giants poised for tax breaks on Louisiana data centers,"In Louisiana, state and local officials who negotiated data center deals say the trade-off is worth it. Tech companies have made it clear that they won’t build here without significant tax breaks.",Baton Rouge Advocate,https://www.theadvocate.com/baton_rouge/news/data-center-meta-amazon-louisiana-tax-break/article_5216ea12-c2e6-5253-a197-c26ae32bfe3a.html,0.0
2026-03-08 09:00:00+00:00,fed,Iceland’s bathing culture has been nominated by Unesco-here's why,"Fed by volcanic heat, Iceland’s geothermal waters have long been used to restore body and mind. From iron-rich mountain baths to silica-filled lagoons, soaking here reveals a culture shaped by elemental forces, where immersion eases muscles, strengthens skin and offers profound mental calm.",National Geographic,https://www.nationalgeographic.com/travel/article/why-icelands-bathing-culture-has-been-nominated-by-unesco,0.0
2026-03-08 09:02:21+00:00,supply chain,Tehran temporarily halts fuel distribution as US-Israel attacks 5 oil depots,"The United States and Israel hit five oil facilities with overnight strikes.Tehran fuel disruption, Iran oil depot strikes, US Israel attacks Iran, AI oil supply chain analysis, LLM impact on energy crisis, Tehran fuel shortage cause, aftermath of Iran oil strikes, toxic fumes Tehran air, radioactive material oil depots, Iran energy security concerns, Middle East conflict oil prices, AI predicting energy disruptions, LLM simulating crisis response, Tehran air quality advisory, Iran oil infrastructure damage",Malayala Manorama,https://www.onmanorama.com/news/world/2026/03/08/tehran-halts-oil-distribution-amid-attack-on-oil-sites.html,0.3333333333333333
2026-03-08 09:30:00+00:00,data center,An Ohio suburb approved a data center; Now a gas plant is going up next to the elementary school,"Hilliard residents say a 2025 state law stripped away their local control, allowing a fuel cell power plant to be fast-tracked near a residential neighborhood. They warn it will happen elsewhere as data centers grow.",cleveland.com,https://www.cleveland.com/news/2026/03/an-ohio-suburb-approved-a-data-center-now-a-gas-plant-is-going-up-next-to-the-elementary-school.html,0.0666666666666666
2026-03-08 09:30:47+00:00,gdp,‘Silver tsunami’ of retiring owners threatens US small businesses: expert,"As baby boomer entrepreneurs retire, a growing leadership gap threatens the small businesses that employ 62 million Americans and generate 43% of U.S. GDP.",Fox Business,https://www.foxbusiness.com/small-business/millions-jobs-vulnerable-silver-tsunami-looms-us-small-businesses-experts-warn,0.0
2026-03-08 10:19:02+00:00,natural gas,Takaichi and Trump are natural fossil fuel buddies - or are they?,"More than a third of Southeast Asia’s coal power finance between 2016 and 2024 came from Japanese banks, and more than a fifth of gas.",The Japan Times ,https://www.japantimes.co.jp/commentary/2026/03/08/japan/takaichi-trump-oil-buddies/,0.0
2026-03-08 10:39:01+00:00,fed,Gen Z Is Trying to Log Their Way Out of Doomscrolling,"Fed up with endless scrolling, some Gen Zers are tracking their media consumption to be more intentional about their time.",Business Insider,https://www.businessinsider.com/gen-z-doomscrolling-tracking-film-podcasts-books-analog-2026-3,0.0
2026-03-08 10:46:20+00:00,default,Upgrade Your Internet Homepage with a Smart New Tab Extension and Productivity Dashboard.,"Every time you open a new tab in your browser, what do you see? A blank screen? A default search bar? Or a distracting news feed? For most people, the new tab page is wasted space. But what if that simple tab could become a powerful productivity dashboard and a smart internet homepage? This is […]",TechBullion,https://techbullion.com/upgrade-your-internet-homepage-with-a-smart-new-tab-extension-and-productivity-dashboard/,0.0666666666666666
2026-03-08 10:53:08+00:00,data center,"KKR eyes multibillion-dollar sale of data center cooling company, FT reports","U.S. private equity firm ​KKR is working with advisers on ‌a sale of data center company CoolIT Systems for a price tag potentially exceeding $3 billion, the Financial Times reported on ​Sunday, citing people familiar with the ​matter.",Reuters,https://www.reuters.com/business/kkr-eyes-multibillion-dollar-sale-data-center-cooling-company-ft-reports-2026-03-08/,0.0
2026-03-08 11:30:00+00:00,fed,Asking Eric: Aging dad insists on asking me questions he can Google much easier and I’m fed up,He thinks it gives us something to talk about.,syracuse.com,https://www.syracuse.com/advice/2026/03/asking-eric-aging-dad-insists-on-asking-me-questions-he-can-google-much-easier-and-im-fed-up.html,0.0
2026-03-08 11:37:12+00:00,supply chain,Delhi Police Busts Major Counterfeit iPhone Parts Racket in Rohini,"The Delhi Police have dismantled a major operation in Rohini dealing in counterfeit iPhone spare parts and accessories, seizing items worth Rs 1.6 crore and arresting five shop owners. The counterfeit goods included various components like batteries and cables, sold as genuine products. Investigations to trace the supply chain are ongoing.",Devdiscourse,https://www.devdiscourse.com/article/law-order/3830179-delhi-police-busts-major-counterfeit-iphone-parts-racket-in-rohini,0.0
2026-03-08 11:41:22+00:00,liquidity,RBI adopts calibrated approach to liquidity management amid tax outflows,"RBI adopts a calibrated liquidity management approach with Rs 1 trillion OMOs to ease tightening from advance tax outflows, even as durable liquidity faces broader pressures",Business Standard,https://www.business-standard.com/industry/banking/rbi-calibrates-liquidity-management-amid-tax-outflows-126030800475_1.html,0.0666666666666666
2026-03-08 12:00:00+00:00,data center,Data center influx prompts more & more communities near Ann Arbor to hit pause,"Communities cite concerns about electricity and water usage, noise, and infrastructure demands as hyperscale projects for cloud computing and AI proliferate.",M Live Michigan ,https://www.mlive.com/news/ann-arbor/2026/03/data-center-influx-prompts-more-more-communities-near-ann-arbor-to-hit-pause.html,0.0
2026-03-08 12:17:02+00:00,supply chain,"Mumbai Malayali woman sparks chips revolution with Kerala home chefs, Govt to emulate project across state","One such kitchen operates at Ezhukone in Kottarakara, Kollam, with support from the Kerala Startup Mission..home food platform, Reshma Suresh Tocco, rural India food makers, connect home chefs, community kitchens India, support senior home cooks, AI powered food sourcing, LLM for food business, Kerala food entrepreneurs, women earning from cooking, homemade snacks online, traditional Indian recipes platform, food tech startup India, AI in food supply chain, empowering rural women",Malayala Manorama,https://www.onmanorama.com/news/kerala/2026/03/08/home-food-platform-tocco-mumbai-malayali-chip-revolution-kerala-home-chefs.html,0.0
2026-03-08 12:28:00+00:00,gdp,China bets on AI-manufacturing integration to narrow digital-economy gap with US,"Beijing's new five-year plan calls for digital economy to account for bigger share of GDP, backed by 28 major projects, 5G upgrades and data-focused industrial policy",The Star,https://www.thestar.com.my/aseanplus/aseanplus-news/2026/03/08/china-bets-on-ai-manufacturing-integration-to-narrow-digital-economy-gap-with-us,0.0
2026-03-08 12:47:03+00:00,unemployment,"Nepal seeks a new deal: For Balen, it’s a crown of thorns","The election result reflects deep frustration with decades of political instability, corruption, nepotism and youth unemployment. The message is clear – perform or perish",Firstpost,https://www.firstpost.com/opinion/us-iran-war-imminence-doctrine-indian-ocean-13987382.html,0.0
2026-03-08 12:49:34+00:00,natural gas,Energy Sector Strained: Middle East Conflict Disrupts Global Oil & Gas Supply,"The ongoing U.S.-Israeli conflict with Iran has significantly disrupted oil and natural gas exports across the Middle East. Production halts affect countries like Kuwait, UAE, and Qatar, reducing global supply. The closure of the Strait of Hormuz and shipping attacks have exacerbated the situation. Nations are seeking alternative supplies as prices rise.",Devdiscourse,https://www.devdiscourse.com/article/headlines/3830239-energy-sector-strained-middle-east-conflict-disrupts-global-oil-gas-supply,0.1333333333333333
2026-03-08 12:55:57+00:00,natural gas,Iran war threatens prolonged impact on energy markets as oil prices rise,The conflict has already led to the suspension of almost a fifth of global crude oil and natural gas supply.,Al Jazeera,https://www.aljazeera.com/news/2026/3/8/iran-war-threatens-prolonged-impact-on-energy-markets-as-oil-prices-rise,0.1333333333333333
2026-03-08 13:10:26+00:00,blockade,Aussie farmers claim they could run out of petrol in DAYS amid Middle East fuel blockade - and it will hit families hard at the supermarket checkout,Major petrol wholesalers are restricting and rationing their sales as the price per barrel for oil surges as the conflict in the Middle East chokes fuel supply.,Daily Mail Online,https://www.dailymail.co.uk/news/article-15626029/Aussie-farmers-claim-run-petrol-days-amid-Middle-East.html,0.1333333333333333
2026-03-08 13:17:00+00:00,supply chain,Kolkata Port signs agreement with East Horizon for Rs 260 crore FSRU project at Haldia,"Syama Prasad Mookerjee Port, Kolkata will soon have a Floating Storage and Regasification Unit at Haldia Dock Complex. East Horizon Pvt Limited will establish this facility. The project involves an investment of approximately Rs 260 crore. This will boost LNG handling capabilities in eastern India. It will also support cleaner energy infrastructure development and strengthen the national gas supply chain.",The Economic Times,https://economictimes.indiatimes.com/industry/transportation/shipping-/-transport/kolkata-port-signs-agreement-with-east-horizon-for-rs-260-crore-fsru-project-at-haldia/articleshow/129271806.cms,0.0
2026-03-08 13:22:29+00:00,fed,Gold Trims Weekly Loss as US Jobs Data Raises Fed Rate Cut Bets,"Gold advanced, trimming a weekly loss as traders raised bets on monetary easing following a weak US jobs report.",Livemint,https://www.livemint.com/market/gold-trims-weekly-loss-as-us-jobs-data-raises-fed-rate-cut-bets-11772976149554.html,0.0
2026-03-08 13:28:49+00:00,fed,Will Crypto Market Crash This Week? Analysts Predict Timeline for Volatility,Crypto market braces for volatility as Bitcoin tests support before key Fed and CPI data this week amid global tensions in the US,CoinGape,https://coingape.com/markets/will-crypto-market-crash-this-week-analysts-predict-timeline-for-volatility/,0.0
2026-03-08 13:39:52+00:00,copper,"AC prices to rise 5-15% as costly copper, weak rupee, RE norms push costs","As the mercury starts rising, leading room airconditioner makers are increasing prices in the range of 5-15 per cent to offset sustained increases in raw material costs and supply chain expenses.",Business Standard,https://www.business-standard.com/industry/news/ac-prices-to-rise-5-15-as-costly-copper-weak-rupee-re-norms-push-costs-126030800561_1.html,0.0
2026-03-08 13:40:08+00:00,fed,"MCX Gold And Silver Price Forecast: Precious Metals Eye Volatility Amid Fed Rate Cut Bets, Middle East Tensions- Check Details","MCX gold may trade between ₹1.55–1.64 lakh and silver ₹2.49–2.85 lakh this week as Fed rate cut bets, dollar strength and Middle East tensions drive volatility.",NewsX,https://www.newsx.com/business/mcx-gold-and-silver-price-forecast-precious-metals-eye-volatility-amid-fed-rate-cut-bets-middle-east-tensions-check-details-179429/,0.0
2026-03-08 13:45:00+00:00,copper,Audiophiles Can't Hear The Difference Between Copper Wires And A Banana,"As spotted by Headphonesty, an amateur experiment had audiophiles guess what was transmitting an audio signal, and most of them couldn't tell the difference.",SlashGear,https://www.slashgear.com/2115474/audiophile-forum-copper-vs-banana-blind-test/,0.0
2026-03-08 13:49:08+00:00,taiwan,All England Open 2026: Lakshay Sen finishes as runner-up after losing to Taiwan’s finalist in Birmingham,"Despite battling blisters and cramps to defeat top-ranked opponents throughout the week, Sen’s second final appearance ended in a fifth consecutive defeat to his familiar rival.",The Financial Express,https://www.financialexpress.com/sports/all-england-open-2026-lakshay-sen-finishes-as-runner-up-after-losing-to-taiwans-finalist-in-birmingham/4166206/,0.0
2026-03-08 13:55:00+00:00,gdp,"India’s economic future lies in clean energy, digital innovation: Suresh Prabhu","Although agriculture accounts for about 55% of employment, its contribution to GDP is only about 15%.",The Indian Express,https://indianexpress.com/article/cities/pune/india-economic-future-clean-energy-digital-innovation-suresh-prabhu-10571705/,0.0
2026-03-08 14:00:57+00:00,data center,Lake County Council to vote on data center decommission ordinance,"The Lake County Council will vote on two ordinances Tuesday related to the decommissioning of data centers and battery energy storage systems, as the county begins considering a data center in unincorporated Lake County.",Chicago Tribune,https://www.chicagotribune.com/2026/03/08/lake-county-council-to-vote-on-data-center-decommission-ordinance/,0.0
2026-03-08 14:05:49+00:00,cpi,"CPI(M) demands package for Polavaram displaced, judicial probe into irregularities",CPI(M) demands rehabilitation packages for Polavaram displaced and a judicial probe into project irregularities and corruption.,The Hindu,https://www.thehindu.com/news/national/andhra-pradesh/cpim-demands-package-for-polavaram-displaced-judicial-probe-into-irregularities/article70718835.ece,0.0
2026-03-08 14:17:00+00:00,cpi,XRP Bollinger Bands Reach Critical Squeeze: Calm Before the Storm?,"As XRP's Bollinger Bands reach a ""squeeze"" last seen before January's 25% rally, the market braces for impact from the March 11 CPI release and the upcoming FOMC meeting.",U.Today,https://u.today/xrp-bollinger-bands-reach-critical-squeeze-calm-before-the-storm,0.0
2026-03-08 14:25:26+00:00,semiconductor,Delhi's leading educational institutions are actively contributing to India Semiconductor Mission: IT Ministry,"Government of India's initiative for prioritising talent development through Training, Up-skilling and Workforce Development Programs under Chips to Startups (C2S) initiative of India Semiconductor Mission (ISM), Union Minister for Railways, Information & Broadcasting, and Electronics & IT, Ashwini Vaishnaw, stated that India has made significant progress in last four years itself for its 10-year target of training 85,000 engineers in semiconductor design.",The Tribune,https://www.tribuneindia.com/news/business/delhis-leading-educational-institutions-are-actively-contributing-to-india-semiconductor-mission-it-ministry/,0.0
